name,title,affiliation,bio,photo,email,linkedin
Matthew Lange,Founder & Director,IC-FOODS,"Founder of IC-FOODS; expert in food systems, semantics, and ontologies.","",,https://www.linkedin.com/in/matthewl
Harold H. Schmitz,Chief Science Officer,Mars Inc.,"Key speaker at IC-FOODS events; leader at Mars Inc.","",,https://www.linkedin.com/in/harold-schmitz
Karen Watson,Strategic Communications Consultant,Independent,"Speaker on language of food and communication strategy.","",,https://www.linkedin.com/in/karen-watson
June Jo Lee,Co-founder,Food Ethnographer LLC,"Food ethnographer focused on culture & strategic consumer insights.","",,https://www.linkedin.com/in/junejolee
Tom Tomich,Professor & Director,UC Davis,"Academic leader in food and agriculture sustainability; active in IC-FOODS conferences.","",,https://www.linkedin.com/in/tom-tomich
